{
  "$schema": "studylab-apkg-manifest.schema.json",
  "manifest_version": "2.0.0",
  "package_version": "2.0.0",
  "package_type": "studylab_procedural_practice",
  "package_classification": "SELF_CONTAINED_PORTABLE",
  "self_contained_verified": true,
  "subject": "Math",
  "chapter": "LCM-HCF",
  "deck_name": "Math::LCM-HCF::StudyLab Procedural",
  "deckName": "Math::LCM-HCF::StudyLab Procedural",
  "deck_id": 2034763231,
  "deckId": 2034763231,
  "apkg_file": "LCM-HCF_StudyLab_Procedural.apkg",
  "apkgFile": "LCM-HCF_StudyLab_Procedural.apkg",
  "generation_timestamp": "2026-10-24T15:10:19.296Z",
  "generatedAt": "2026-10-24T15:10:19.296Z",
  "generation_version": "2.0.0",
  "contract_version": "2.0.0",
  "concept_count": 1,
  "skill_count": 1,
  "question_type_count": 8,
  "source_question_count": 8,
  "canonical_question_count": 8,
  "generated_variant_count": 0,
  "instance_count": 8,
  "archetype_count": 8,
  "variant_count": 16,
  "object_count": 8,
  "hint_coverage": 100,
  "solution_coverage": 100,
  "diagnostic_coverage": 100,
  "remediation_coverage": 100,
  "adaptive_metadata_coverage": 100,
  "readiness_breakdown": {
    "structural_coverage": 11.1,
    "source_depth": "8 distinct canonical source questions (1 per question type)",
    "variant_depth": "16 parameter & structural variants across 8 archetypes",
    "mock_readiness": "TOPIC_PRACTICE_ONLY (Difficulty Range [1.0, 3.0])"
  },
  "totalItems": 8,
  "totalQuestions": 8,
  "totalPatterns": 8,
  "difficulty_coverage": {
    "min": 1,
    "max": 3,
    "mean": 2.06,
    "bands": {
      "1": 2,
      "2": 5,
      "3": 1,
      "4": 0,
      "5": 0
    }
  },
  "coverage_summary": {
    "total_chapter_skills": 9,
    "covered_skills": 1,
    "coverage_percentage": 11.1,
    "uncovered_skills": [
      "pat-lcm-hcf-001",
      "pat-lcm-hcf-002",
      "pat-lcm-hcf-003",
      "pat-lcm-hcf-004",
      "pat-lcm-hcf-005",
      "pat-lcm-hcf-006",
      "pat-lcm-hcf-007",
      "pat-lcm-hcf-008"
    ],
    "modality_breakdown": {
      "mcq": 8,
      "numerical": 0,
      "stepwise": 0,
      "reference_only": 0
    }
  },
  "question_types": [
    {
      "type_id": "pat-lcm-hcf-001",
      "name": "Prime Factorization Method",
      "object_types": [
        "mcq"
      ],
      "required_interaction": "mcq_discrete_options",
      "coverage": {
        "instance_count": 1,
        "authentic_pyq_count": 1,
        "synthetic_count": 0,
        "source_question_count": 1,
        "canonical_problem_count": 1,
        "generated_variant_count": 0,
        "difficulty_coverage": {
          "min": 1.5,
          "max": 1.5,
          "mean": 1.5
        }
      },
      "hint_status": "COMPLETE_3_TIER",
      "solution_status": "COMPLETE_STEP_GRAPH",
      "diagnostic_status": "EXPLICIT_TAXONOMY_MAPPED",
      "remediation_status": "REMEDIATION_PATH_DECLARED"
    },
    {
      "type_id": "pat-lcm-hcf-002",
      "name": "Product Identity",
      "object_types": [
        "mcq"
      ],
      "required_interaction": "mcq_discrete_options",
      "coverage": {
        "instance_count": 1,
        "authentic_pyq_count": 1,
        "synthetic_count": 0,
        "source_question_count": 1,
        "canonical_problem_count": 1,
        "generated_variant_count": 0,
        "difficulty_coverage": {
          "min": 2,
          "max": 2,
          "mean": 2
        }
      },
      "hint_status": "COMPLETE_3_TIER",
      "solution_status": "COMPLETE_STEP_GRAPH",
      "diagnostic_status": "EXPLICIT_TAXONOMY_MAPPED",
      "remediation_status": "REMEDIATION_PATH_DECLARED"
    },
    {
      "type_id": "pat-lcm-hcf-003",
      "name": "Equal Remainder with Smallest Divisible",
      "object_types": [
        "mcq"
      ],
      "required_interaction": "mcq_discrete_options",
      "coverage": {
        "instance_count": 1,
        "authentic_pyq_count": 1,
        "synthetic_count": 0,
        "source_question_count": 1,
        "canonical_problem_count": 1,
        "generated_variant_count": 0,
        "difficulty_coverage": {
          "min": 2.5,
          "max": 2.5,
          "mean": 2.5
        }
      },
      "hint_status": "COMPLETE_3_TIER",
      "solution_status": "COMPLETE_STEP_GRAPH",
      "diagnostic_status": "EXPLICIT_TAXONOMY_MAPPED",
      "remediation_status": "REMEDIATION_PATH_DECLARED"
    },
    {
      "type_id": "pat-lcm-hcf-004",
      "name": "Ratio & Common Factor Decomposition",
      "object_types": [
        "mcq"
      ],
      "required_interaction": "mcq_discrete_options",
      "coverage": {
        "instance_count": 1,
        "authentic_pyq_count": 1,
        "synthetic_count": 0,
        "source_question_count": 1,
        "canonical_problem_count": 1,
        "generated_variant_count": 0,
        "difficulty_coverage": {
          "min": 2,
          "max": 2,
          "mean": 2
        }
      },
      "hint_status": "COMPLETE_3_TIER",
      "solution_status": "COMPLETE_STEP_GRAPH",
      "diagnostic_status": "EXPLICIT_TAXONOMY_MAPPED",
      "remediation_status": "REMEDIATION_PATH_DECLARED"
    },
    {
      "type_id": "pat-lcm-hcf-005",
      "name": "Fraction LCM & HCF",
      "object_types": [
        "mcq"
      ],
      "required_interaction": "mcq_discrete_options",
      "coverage": {
        "instance_count": 1,
        "authentic_pyq_count": 1,
        "synthetic_count": 0,
        "source_question_count": 1,
        "canonical_problem_count": 1,
        "generated_variant_count": 0,
        "difficulty_coverage": {
          "min": 2,
          "max": 2,
          "mean": 2
        }
      },
      "hint_status": "COMPLETE_3_TIER",
      "solution_status": "COMPLETE_STEP_GRAPH",
      "diagnostic_status": "EXPLICIT_TAXONOMY_MAPPED",
      "remediation_status": "REMEDIATION_PATH_DECLARED"
    },
    {
      "type_id": "pat-lcm-hcf-006",
      "name": "Bells Ringing & Circular Motion Intervals",
      "object_types": [
        "mcq"
      ],
      "required_interaction": "mcq_discrete_options",
      "coverage": {
        "instance_count": 1,
        "authentic_pyq_count": 1,
        "synthetic_count": 0,
        "source_question_count": 1,
        "canonical_problem_count": 1,
        "generated_variant_count": 0,
        "difficulty_coverage": {
          "min": 2.5,
          "max": 2.5,
          "mean": 2.5
        }
      },
      "hint_status": "COMPLETE_3_TIER",
      "solution_status": "COMPLETE_STEP_GRAPH",
      "diagnostic_status": "EXPLICIT_TAXONOMY_MAPPED",
      "remediation_status": "REMEDIATION_PATH_DECLARED"
    },
    {
      "type_id": "pat-lcm-hcf-007",
      "name": "Greatest Number Leaving Equal Remainder",
      "object_types": [
        "mcq"
      ],
      "required_interaction": "mcq_discrete_options",
      "coverage": {
        "instance_count": 1,
        "authentic_pyq_count": 1,
        "synthetic_count": 0,
        "source_question_count": 1,
        "canonical_problem_count": 1,
        "generated_variant_count": 0,
        "difficulty_coverage": {
          "min": 3,
          "max": 3,
          "mean": 3
        }
      },
      "hint_status": "COMPLETE_3_TIER",
      "solution_status": "COMPLETE_STEP_GRAPH",
      "diagnostic_status": "EXPLICIT_TAXONOMY_MAPPED",
      "remediation_status": "REMEDIATION_PATH_DECLARED"
    },
    {
      "type_id": "pat-lcm-hcf-008",
      "name": "Consecutive Co-prime Products",
      "object_types": [
        "mcq"
      ],
      "required_interaction": "mcq_discrete_options",
      "coverage": {
        "instance_count": 1,
        "authentic_pyq_count": 1,
        "synthetic_count": 0,
        "source_question_count": 1,
        "canonical_problem_count": 1,
        "generated_variant_count": 0,
        "difficulty_coverage": {
          "min": 1,
          "max": 1,
          "mean": 1
        }
      },
      "hint_status": "COMPLETE_3_TIER",
      "solution_status": "COMPLETE_STEP_GRAPH",
      "diagnostic_status": "EXPLICIT_TAXONOMY_MAPPED",
      "remediation_status": "REMEDIATION_PATH_DECLARED"
    }
  ],
  "items": [
    {
      "note_id": 1700008000000,
      "card_id": 1700009000000,
      "noteId": 1700008000000,
      "cardId": 1700009000000,
      "guid": "OOcaq4YASm",
      "practice_question_id": "q-lcm-01",
      "practiceQuestionId": "q-lcm-01",
      "pattern_id": "pat-lcm-hcf-001",
      "patternId": "pat-lcm-hcf-001",
      "schema_id": "schema.math.number_system.lcm_hcf.v1",
      "schemaId": "schema.math.number_system.lcm_hcf.v1",
      "proc_schema": "schema.math.number_system.lcm_hcf.v1",
      "procSchema": "schema.math.number_system.lcm_hcf.v1",
      "problem_type": "Prime Factorization Method",
      "problemType": "Prime Factorization Method",
      "question_type": "mcq",
      "questionType": "mcq",
      "origin_type": "AUTHENTIC_PYQ",
      "originType": "AUTHENTIC_PYQ",
      "domain": "Math",
      "problem_family": "lcm_hcf_basic",
      "problemFamily": "lcm_hcf_basic",
      "difficulty": 1.5,
      "has_inline_contract": true,
      "hasInlineContract": true,
      "is_self_contained": true,
      "isSelfContained": true
    },
    {
      "note_id": 1700008000001,
      "card_id": 1700009000001,
      "noteId": 1700008000001,
      "cardId": 1700009000001,
      "guid": "LdzvDXLSIr",
      "practice_question_id": "q-lcm-02",
      "practiceQuestionId": "q-lcm-02",
      "pattern_id": "pat-lcm-hcf-002",
      "patternId": "pat-lcm-hcf-002",
      "schema_id": "schema.math.number_system.lcm_hcf.relation.v1",
      "schemaId": "schema.math.number_system.lcm_hcf.relation.v1",
      "proc_schema": "schema.math.number_system.lcm_hcf.relation.v1",
      "procSchema": "schema.math.number_system.lcm_hcf.relation.v1",
      "problem_type": "Product Identity",
      "problemType": "Product Identity",
      "question_type": "mcq",
      "questionType": "mcq",
      "origin_type": "AUTHENTIC_PYQ",
      "originType": "AUTHENTIC_PYQ",
      "domain": "Math",
      "problem_family": "lcm_hcf_relation",